{"schema":1,"dsh_version":"0.1.1-rc.1","node_version":"24.15.0","minimum_desktop_version":"0.1.0","platform":"windows","arch":"x86_64","artifact":{"url":"https://downloads.example.com/dsh/runtime-0.1.1-rc.1.zip","size":1048576,"sha256":"0123456789abcdef0123456789abcdef0123456789abcdef0123456789abcdef"},"verified_at":"2026-08-21T09:30:00Z","compatibility_summary":"已验证 Windows 10/11 x64 桌面运行与隔离数据升级。"}
